Layer,Domain Entity,File Path,File Purpose,Key Pattern,Dependencies,Extends/Conforms,Concurrency,Complexity,Notes
View-Component,Cross-cutting,swift/Sources/App/Views/Components/FormComponents/MultiSelectSection.swift,Reusable multi-select section with Toggle bindings,SwiftUI View,,Identifiable,None,Simple,
View-Component,Cross-cutting,swift/Sources/App/Views/Components/FormComponents/RepeatingSection.swift,"Container for add/remove item sections (measurements, targets, etc.)",SwiftUI View,,Identifiable,None,Simple,
View-Component,Cross-cutting,swift/Sources/App/Views/Components/FormComponents/TimingSection.swift,Standard timing fields (when + duration) with consistent styling,SwiftUI View,,View,None,Simple,
View-Component,Cross-cutting,swift/Sources/App/Views/Components/GoalComponents/ProgressIndicator.swift,Visual indicator for goal progress (multi-metric),SwiftUI View,Models,View,None,Medium,
View-Component,Cross-cutting,swift/Sources/App/Views/Components/QuickAddSection.swift,Quick action entry from recent history or active goals,SwiftUI View,"Models, Services","View, View",None,Medium,
View-Component,Measure,swift/Sources/App/Views/Components/FormComponents/MeasurementInputRow.swift,Reusable row component for measure + value entry,SwiftUI View,Models,View,None,Simple,
View-Dashboard,Cross-cutting,swift/Sources/App/Views/Dashboard/DashboardView.swift,Main dashboard with analytics cards,SwiftUI View,,View,None,Simple,
View-Debug,Cross-cutting,swift/Sources/App/Views/Debug/SyncDebugView.swift,,SwiftUI View,"Database, Dependencies, SQLiteData",View,@MainActor,Medium,
View-Debug,Measure,swift/Sources/App/Views/Debug/MeasureDeduplicationView.swift,In-app UI for merging duplicate measures,@Observable @MainActor,"Dependencies, Models, Services","View, View, View",@MainActor,Medium,
View-Form,Action,swift/Sources/App/Views/FormViews/ActionFormView.swift,Form for creating/editing Actions with measurements and goal contributions,SwiftUI View,"Models, Services","Identifiable, View",None,Medium,
View-Form,Goal,swift/Sources/App/Views/FormViews/GoalFormView.swift,Form for creating/editing Goals with full relationship support,SwiftUI View,"Dependencies, Models, SQLiteData, Services",View,@MainActor,Medium,
View-Form,Milestone,swift/Sources/App/Views/FormViews/MilestoneFormView.swift,Form for creating milestones,SwiftUI View,"Models, Services",View,None,Simple,
View-Form,Obligation,swift/Sources/App/Views/FormViews/ObligationFormView.swift,Form for creating obligations,SwiftUI View,"Models, Services",View,None,Simple,
View-Form,PersonalValue,swift/Sources/App/Views/FormViews/PersonalValuesFormView.swift,Form view for PersonalValue creation and editing,SwiftUI View,"Models, Services",View,None,Medium,
View-Form,TimePeriod,swift/Sources/App/Views/FormViews/TermFormView.swift,User-friendly form for creating/editing Terms (wraps generic TimePeriodFormViewModel),SwiftUI View,"Models, Services",View,None,Medium,
View-Health,Cross-cutting,swift/Sources/App/Views/Health/WorkoutDetailView.swift,// Detailed view showing all data for a single workout from HealthKit,SwiftUI View,"HealthKit, Services","View, View, View",None,Medium,
View-Health,Cross-cutting,swift/Sources/App/Views/Health/WorkoutsTestView.swift,// Simple test view to validate HealthKit data flow on iOS.,@Observable,"HealthKit, Models, Services","View, View, View",None,Complex,
View-Health,HealthKit,swift/Sources/App/Views/Health/HealthDashboardTestView.swift,// Simple test view to verify HealthKit live tracking integration.,SwiftUI View,Services,"View, View",None,Medium,
View-LLM,Goal,swift/Sources/App/Views/LLM/GoalCoachView.swift,Chat interface for AI goal coaching,SwiftUI View,,"View, View",None,Medium,
View-List,Action,swift/Sources/App/Views/ListViews/ActionsListView.swift,List view for Actions with measurements and goal contributions,SwiftUI View,"Models, Services",View,None,Medium,
View-List,Goal,swift/Sources/App/Views/ListViews/GoalsListView.swift,List of goals with progress and alignment display,SwiftUI View,Models,View,None,Simple,
View-List,Milestone,swift/Sources/App/Views/ListViews/MilestonesListView.swift,List of milestones with upcoming dates,SwiftUI View,"Models, Services",View,None,Simple,
View-List,Obligation,swift/Sources/App/Views/ListViews/ObligationsListView.swift,List of obligations with deadlines,SwiftUI View,"Models, Services",View,None,Simple,
View-List,PersonalValue,swift/Sources/App/Views/ListViews/PersonalValuesListView.swift,List of personal values with priority and level display,SwiftUI View,Models,View,None,Medium,
View-List,TimePeriod,swift/Sources/App/Views/ListViews/TermsListView.swift,List view showing Terms with their TimePeriod details,@Observable,Models,View,None,Medium,
View-Row,Action,swift/Sources/App/Views/RowViews/ActionRowView.swift,// Displays Action with measurements and goal contributions.,SwiftUI View,"Models, Services",View,None,Simple,
View-Row,Goal,swift/Sources/App/Views/RowViews/GoalRowView.swift,Display row for Goal with multi-metric progress and value alignment,SwiftUI View,Models,View,None,Medium,
View-Row,Milestone,swift/Sources/App/Views/RowViews/MilestoneRowView.swift,Row view for displaying a single milestone in a list,SwiftUI View,"Models, Services",View,None,Simple,
View-Row,Obligation,swift/Sources/App/Views/RowViews/ObligationRowView.swift,Row view for displaying a single obligation in a list,SwiftUI View,"Models, Services",View,None,Simple,
View-Row,PersonalValue,swift/Sources/App/Views/RowViews/PersonalValuesRowView.swift,,SwiftUI View,Models,View,None,Simple,
View-Row,TimePeriod,swift/Sources/App/Views/RowViews/TermRowView.swift,Row display for Term with TimePeriod details,SwiftUI View,Models,View,None,Simple,
View-Template,Cross-cutting,swift/Sources/App/Views/Templates/BadgeView.swift,"// Provides compact, colored badges for displaying entity metadata",SwiftUI View,,"Identifiable, View",None,Simple,
View-Template,Cross-cutting,swift/Sources/App/Views/Templates/DateGrouping.swift,"// Provides date-based grouping for entity lists (Today, Yesterday, This Week, etc.)",,,Identifiable,None,Medium,
View-Template,Cross-cutting,swift/Sources/App/Views/Templates/DocumentableFields.swift,"// Shared form section for DomainAbstraction entities (Actions, Values, TimePeriods, etc.)",SwiftUI View,,View,None,Simple,
View-Template,Cross-cutting,swift/Sources/App/Views/Templates/EntityRowView.swift,"// Provides consistent layout for entity rows across Actions, Goals, Terms, and Values.",SwiftUI View,,,None,Medium,
View-Template,Cross-cutting,swift/Sources/App/Views/Templates/FormHelpers.swift,"// Common validation utilities, date helpers, and formatters",,,,None,Simple,
View-Template,Cross-cutting,swift/Sources/App/Views/Templates/ValidationFeedback.swift,// Displays validation status (valid/invalid) and lists any validation errors.,SwiftUI View,,View,None,Simple,
View-Template,Measure,swift/Sources/App/Views/Templates/MeasurementDisplay.swift,// Provides pre-formatted measurement data to row views across all entities.,,,Identifiable,None,Medium,
ViewModel-Form,Action,swift/Sources/App/ViewModels/FormViewModels/ActionFormViewModel.swift,ViewModel for Action forms (create + edit),@Observable @MainActor,"Dependencies, Models, Observation, SQLiteData, Services",,@MainActor,Medium,
ViewModel-Form,Goal,swift/Sources/App/ViewModels/FormViewModels/GoalFormViewModel.swift,@Observable ViewModel for Goal forms,@Observable @MainActor,"Dependencies, Models, SQLiteData, Services",,@MainActor,Medium,
ViewModel-Form,Milestone,swift/Sources/App/ViewModels/FormViewModels/MilestoneFormViewModel.swift,ViewModel for Milestone forms (create + edit),@Observable @MainActor,"Dependencies, Models, Observation, SQLiteData, Services",,@MainActor,Simple,
ViewModel-Form,Obligation,swift/Sources/App/ViewModels/FormViewModels/ObligationFormViewModel.swift,ViewModel for Obligation forms (create + edit),@Observable @MainActor,"Dependencies, Models, Observation, SQLiteData, Services",,@MainActor,Simple,
ViewModel-Form,PersonalValue,swift/Sources/App/ViewModels/FormViewModels/PersonalValuesFormViewModel.swift,Creates new PersonalValue from form data.,@Observable @MainActor,"Dependencies, Models, Observation, SQLiteData, Services",,@MainActor,Simple,
ViewModel-Form,TimePeriod,swift/Sources/App/ViewModels/FormViewModels/TimePeriodFormViewModel.swift,Generic ViewModel for TimePeriod creation (works with all specializations),@Observable @MainActor,"Dependencies, Models, Observation, SQLiteData, Services",,@MainActor,Medium,
ViewModel-LLM,Goal,swift/Sources/App/ViewModels/LLMViewModels/GoalCoachViewModel.swift,Message in the conversation,@Observable @MainActor,"Dependencies, FoundationModels, Models, SQLiteData, Services","Identifiable, Sendable, Sendable",Sendable + @MainActor,Medium,
ViewModel-List,Action,swift/Sources/App/ViewModels/ListViewModels/ActionsListViewModel.swift,// ViewModel for ActionsListView - manages actions list state and repository access.,@Observable @MainActor,"Dependencies, Models, Observation, Services",,@MainActor,Medium,
ViewModel-List,Goal,swift/Sources/App/ViewModels/ListViewModels/GoalsListViewModel.swift,// ViewModel for GoalsListView - manages goals list state and repository access.,@Observable @MainActor,"Dependencies, Models, Observation, Services",,@MainActor,Simple,
ViewModel-List,Milestone,swift/Sources/App/ViewModels/ListViewModels/MilestonesListViewModel.swift,ViewModel for Milestones list view,@Observable @MainActor,"Dependencies, Models, Observation, SQLiteData, Services",,@MainActor,Simple,
ViewModel-List,Obligation,swift/Sources/App/ViewModels/ListViewModels/ObligationsListViewModel.swift,ViewModel for Obligations list view,@Observable @MainActor,"Dependencies, Models, Observation, SQLiteData, Services",,@MainActor,Simple,
ViewModel-List,PersonalValue,swift/Sources/App/ViewModels/ListViewModels/PersonalValuesListViewModel.swift,// ViewModel for PersonalValuesListView - manages values list state and repository access.,@Observable @MainActor,"Dependencies, Models, Observation, Services",,@MainActor,Simple,
ViewModel-List,TimePeriod,swift/Sources/App/ViewModels/ListViewModels/TermsListViewModel.swift,// ViewModel for TermsListView - manages terms list state and repository access.,@Observable @MainActor,"Dependencies, Models, Observation, Services",,@MainActor,Simple,
ViewModel-Utility,Cross-cutting,swift/Sources/App/ViewModels/UtilityViewModels/ExportViewModel.swift,// Orchestrates data export operations - UI state management only.,@Observable @MainActor,"Dependencies, Models, SQLiteData, Services","String, CaseIterable, String, CaseIterable",@MainActor,Simple,
ViewModel-Utility,HealthKit,swift/Sources/App/ViewModels/HealthDashboardViewModel.swift,// ViewModel for real-time health metrics dashboard with live HealthKit tracking.,@Observable @MainActor,"Dependencies, Observation, Services",,@MainActor,Medium,
ViewModel-Utility,PersonalValue,swift/Sources/App/ViewModels/ValueAlignmentHeatmapViewModel.swift,// ViewModel for Value Alignment Heatmap view.,@Observable @MainActor,"Database, Dependencies, Models, Observation, Services",,@MainActor,Medium,
