Layer,Domain Entity,File Path,File Purpose,Key Pattern,Dependencies,Extends/Conforms,Concurrency,Complexity,Notes
Coordinator,Action,swift/Sources/Services/Coordinators/ActionCoordinator.swift,Coordinates creation of Action entities with measurements and goal contributions,Sendable Coordinator,"Dependencies, Models, SQLiteData",Sendable,Sendable,Medium,
Coordinator,Goal,swift/Sources/Services/Coordinators/GoalCoordinator.swift,Coordinates creation of Goal entities with full relationship graph,Sendable Coordinator,"Dependencies, Models, SQLiteData",Sendable,Sendable,Complex,
Coordinator,Measure,swift/Sources/Services/Coordinators/MeasureCoordinator.swift,Coordinate Measure entity persistence with duplicate prevention,Sendable Coordinator,"Dependencies, Models, SQLiteData",Sendable,Sendable + @MainActor,Medium,
Coordinator,Measure,swift/Sources/Services/Coordinators/MeasureDeduplicationCoordinator.swift,One-off utility for merging duplicate measures,Sendable Coordinator,"Dependencies, Models, SQLiteData","Sendable, Identifiable, Sendable, Sendable",Sendable,Medium,
Coordinator,Milestone,swift/Sources/Services/Coordinators/MilestoneCoordinator.swift,Coordinates creation of Milestone entities with atomic persistence,Sendable Coordinator,"Models, SQLiteData",Sendable,Sendable + @MainActor,Medium,
Coordinator,Obligation,swift/Sources/Services/Coordinators/ObligationCoordinator.swift,Coordinates creation of Obligation entities with atomic persistence,Sendable Coordinator,"Models, SQLiteData",Sendable,Sendable + @MainActor,Medium,
Coordinator,PersonalValue,swift/Sources/Services/Coordinators/PersonalValueCoordinator.swift,Coordinates creation of PersonalValue entities with atomic persistence.,Sendable Coordinator,"Dependencies, Models, SQLiteData",Sendable,Sendable + @MainActor,Medium,
Coordinator,TimePeriod,swift/Sources/Services/Coordinators/TimePeriodCoordinator.swift,"Coordinates creation of TimePeriod entities with specializations (GoalTerm, Year, etc.)",Sendable Coordinator,"Models, SQLiteData",Sendable,Sendable,Medium,
Coordinator-FormData,Action,swift/Sources/Services/Coordinators/FormData/ActionFormData.swift,// Input DTO for ActionCoordinator. Holds form state and validates before persistence.,Sendable Coordinator,Models,"Sendable, Identifiable, Sendable",Sendable,Simple,
Coordinator-FormData,Expectation,swift/Sources/Services/Coordinators/FormData/ExpectationFormDataBase.swift,"Protocol for shared expectation fields across Goal, Milestone, Obligation FormData",,,ExpectationFormDataBase,Sendable,Simple,
Coordinator-FormData,Goal,swift/Sources/Services/Coordinators/FormData/GoalFormData.swift,Input DTO for GoalCoordinator,,Models,"ExpectationFormDataBase, Sendable",None,Simple,
Coordinator-FormData,Measure,swift/Sources/Services/Coordinators/FormData/ExpectationMeasureFormData.swift,Form data for ExpectationMeasure creation (goal metric targets),,,"Identifiable, Sendable",None,Simple,
Coordinator-FormData,Measure,swift/Sources/Services/Coordinators/FormData/MeasureFormData.swift,Form data for Measure creation and editing.,Sendable Coordinator,Models,Sendable,Sendable,Simple,
Coordinator-FormData,Milestone,swift/Sources/Services/Coordinators/FormData/MilestoneFormData.swift,Input DTO for MilestoneCoordinator,,Models,"ExpectationFormDataBase, Sendable",None,Simple,
Coordinator-FormData,Obligation,swift/Sources/Services/Coordinators/FormData/ObligationFormData.swift,Input DTO for ObligationCoordinator,,Models,"ExpectationFormDataBase, Sendable",None,Simple,
Coordinator-FormData,PersonalValue,swift/Sources/Services/Coordinators/FormData/PersonalValueFormData.swift,Form data for PersonalValue creation and editing.,Sendable Coordinator,Models,Sendable,Sendable,Simple,
Coordinator-FormData,PersonalValue,swift/Sources/Services/Coordinators/FormData/ValueAlignmentInput.swift,Helper struct for value alignment input in goal forms,,,"Identifiable, Sendable",None,Simple,
Coordinator-FormData,TimePeriod,swift/Sources/Services/Coordinators/FormData/TimePeriodFormData.swift,Form data structure for creating TimePeriod entities with specializations,,Models,"Sendable, Sendable",Sendable,Simple,
Database,Cross-cutting,swift/Sources/Database/CloudKitManualSync.swift,Manual CloudKit fetch when SQLiteData doesn't expose it,,CloudKit,LocalizedError,None,Simple,
Database,Cross-cutting,swift/Sources/Database/DatabaseBootstrap.swift,Database configuration mode,,"GRDB, Models, SQLiteData",Error,None,Simple,
Database,Cross-cutting,swift/Sources/Database/SyncConfiguration.swift,Configuration for CloudKit sync,,"GRDB, Models, SQLiteData",,None,Simple,
Model-Abstraction,Action,swift/Sources/Models/Abstractions/Action.swift,"An action taken at a point in time, with optional timing",@Table,SQLiteData,DomainAbstraction,@MainActor,Simple,
Model-Abstraction,Cross-cutting,swift/Sources/Models/Abstractions/Protocols.swift,All database entities must conform to Swift's Identifiable with UUID,@Table,SQLiteData,"Abstract, Basic, Composit",None,Simple,
Model-Abstraction,Expectation,swift/Sources/Models/Abstractions/Expectation.swift,Classification of expectation types,@Table,SQLiteData,"String, Codable, CaseIterable, Sendable, QueryRepresentable,
    QueryBindable, DomainAbstraction",None,Medium,
Model-Abstraction,Measure,swift/Sources/Models/Abstractions/Measure.swift,Catalog entry for a unit of measurement,@Table,SQLiteData,DomainAbstraction,None,Medium,
Model-Abstraction,PersonalValue,swift/Sources/Models/Abstractions/PersonalValue.swift,Classification of value types,@Table,SQLiteData,"String, Codable, CaseIterable, Sendable, QueryRepresentable, QueryBindable, DomainAbstraction",None,Medium,
Model-Abstraction,TimePeriod,swift/Sources/Models/Abstractions/TimePeriod.swift,// Represents pure time spans (start → end) without goal planning semantics.,@Table,SQLiteData,DomainAbstraction,None,Simple,
Model-Basic,Goal,swift/Sources/Models/Basics/Goal.swift,Goal subtype - objectives with date ranges and action plans,@Table,SQLiteData,DomainBasic,None,Simple,
Model-Basic,Measure,swift/Sources/Models/Basics/ExpectationMeasure.swift,Links an expectation to a metric with a target value,@Table,SQLiteData,DomainBasic,None,Simple,
Model-Basic,Milestone,swift/Sources/Models/Basics/Milestone.swift,Milestone subtype - point-in-time checkpoint,@Table,SQLiteData,DomainBasic,None,Simple,
Model-Basic,Obligation,swift/Sources/Models/Basics/Obligation.swift,Obligation subtype - external commitment or requirement,@Table,SQLiteData,DomainBasic,None,Simple,
Model-Basic,TimePeriod,swift/Sources/Models/Basics/Term.swift,Status of a goal planning term,@Table,SQLiteData,"String, Codable, CaseIterable, Sendable, QueryRepresentable, QueryBindable, DomainBasic",None,Simple,
Model-Composit,Action,swift/Sources/Models/Composits/MeasuredAction.swift,Links an action to a metric with a measured value,@Table,SQLiteData,DomainComposit,None,Simple,
Model-Composit,Goal,swift/Sources/Models/Composits/ActionGoalContribution.swift,Tracks how an action contributes to a goal's progress,@Table,SQLiteData,DomainComposit,None,Simple,
Model-Composit,Goal,swift/Sources/Models/Composits/GoalRelevance.swift,Links a goal to a value it serves or aligns with,@Table,SQLiteData,DomainComposit,None,Simple,
Model-Composit,Goal,swift/Sources/Models/Composits/TermGoalAssignment.swift,Junction table record for term-goal assignments,@Table,SQLiteData,DomainComposit,None,Simple,
Model-DataType,Action,swift/Sources/Models/DataTypes/ActionData.swift,// Canonical data type for Actions - serves both display and export needs.,,,"Identifiable, Hashable, Sendable, Codable, Identifiable, Hashable, Sendable, Codable, Identifiable, Hashable, Sendable, Codable",None,Simple,
Model-DataType,Cross-cutting,swift/Sources/Models/DataTypes/ProgressData.swift,Canonical data types for progress tracking across all Expectation types,,,"String, Codable, Sendable, CaseIterable, String, Codable, Sendable, CaseIterable, String, Codable, Sendable, CaseIterable, String, Codable, Sendable, CaseIterable, String, Codable, Sendable, CaseIterable, Identifiable, Hashable, Sendable, Codable, Identifiable, Hashable, Sendable, Codable, Identifiable, Hashable, Sendable, Codable, Identifiable, Hashable, Sendable, Codable, Identifiable, Hashable, Sendable, Codable, Identifiable, Hashable, Sendable, Codable, Identifiable, Hashable, Sendable, Codable, Identifiable, Hashable, Sendable, Codable",Sendable,Complex,
Model-DataType,Goal,swift/Sources/Models/DataTypes/GoalData.swift,// Canonical goal data structure that serves both display and export needs.,,,"Identifiable, Hashable, Sendable, Codable, Identifiable, Hashable, Sendable, Codable, Identifiable, Hashable, Sendable, Codable, Identifiable, Hashable, Sendable, Codable",None,Medium,
Model-DataType,Measure,swift/Sources/Models/DataTypes/MeasureData.swift,// Canonical measure data structure that serves both display and export needs.,,,"Identifiable, Hashable, Sendable, Codable",None,Simple,
Model-DataType,PersonalValue,swift/Sources/Models/DataTypes/PersonalValueData.swift,// Canonical personal value data structure that serves both display and export needs.,,,"Identifiable, Hashable, Sendable, Codable",None,Simple,
Model-DataType,TimePeriod,swift/Sources/Models/DataTypes/TimePeriodData.swift,// Canonical data type for TimePeriods with GoalTerm planning semantics.,,,"Identifiable, Hashable, Sendable, Codable",None,Simple,
Model-Deduplication,Cross-cutting,swift/Sources/Models/Deduplication/DuplicateCandidate.swift,Represents a potential duplicate entity pair requiring user review,@Table,SQLiteData,"DomainComposit, String, Codable, Sendable, QueryRepresentable, QueryBindable, String, Codable, Sendable, QueryRepresentable, QueryBindable, String, Codable, Sendable, QueryRepresentable, QueryBindable, String, Codable, Sendable, QueryRepresentable, QueryBindable",None,Medium,
Model-Deduplication,Cross-cutting,swift/Sources/Models/Deduplication/EntitySignature.swift,Precomputed MinHash signature for an entity,@Table,SQLiteData,DomainComposit,None,Simple,
Model-Semantic,Cross-cutting,swift/Sources/Models/SemanticTypes/AlignmentMatrix.swift,// Structured container for goal-value alignment heatmap data.,,Models,"Sendable, Identifiable, Hashable, Sendable, String, Sendable, CaseIterable, Sendable",Sendable,Medium,
Model-Semantic,Semantic,swift/Sources/Models/SemanticTypes/EmbeddingCacheEntry.swift,Cached semantic embedding for an entity,@Table,SQLiteData,"Sendable, Identifiable",Sendable,Simple,
Model-Semantic,Semantic,swift/Sources/Models/SemanticTypes/EmbeddingVector.swift,Errors for embedding vector operations,,,"LocalizedError, Sendable, Sendable, Equatable, Hashable",Sendable,Simple,
Model-Semantic,Semantic,swift/Sources/Models/SemanticTypes/SemanticConfiguration.swift,Configuration for semantic similarity and search operations,,,Sendable,Sendable,Simple,
Repository,Action,swift/Sources/Services/Repositories/ActionRepository.swift,// Repository for Action entities using canonical ActionData type.,BaseRepository<ActionData>,"GRDB, Models, SQLiteData","BaseRepository<ActionData>, Decodable, FetchableRecord, Sendable, Decodable, Sendable, Decodable, Sendable",@unchecked Sendable,Complex,
Repository,Cross-cutting,swift/Sources/Services/Repositories/ConversationRepository.swift,Repository for managing LLM conversation data,,"GRDB, SQLiteData","Sendable, String, Sendable, CaseIterable, String, Sendable, String, Sendable, Sendable, Identifiable, Sendable, Identifiable, Sendable",Sendable,Complex,
Repository,Goal,swift/Sources/Services/Repositories/GoalRepository.swift,// Repository for Goal entities using canonical GoalData type.,BaseRepository<GoalData>,"GRDB, Models, SQLiteData","BaseRepository<GoalData>, Decodable, FetchableRecord, Sendable, Decodable, Sendable, Decodable, Sendable, Decodable, Sendable",@unchecked Sendable,Complex,
Repository,Measure,swift/Sources/Services/Repositories/MeasureRepository.swift,// Repository for Measure entities using canonical MeasureData type.,BaseRepository<MeasureData>,"GRDB, Models, SQLiteData","BaseRepository<MeasureData>, Decodable, FetchableRecord, Sendable",@unchecked Sendable,Medium,
Repository,Milestone,swift/Sources/Services/Repositories/MilestoneRepository.swift,Repository for Milestone entities,BaseRepository,"GRDB, Models, SQLiteData","Sendable, Decodable, FetchableRecord, Identifiable, Hashable, Sendable",Sendable,Medium,
Repository,Obligation,swift/Sources/Services/Repositories/ObligationRepository.swift,Repository for Obligation entities,BaseRepository,"GRDB, Models, SQLiteData","Sendable, Decodable, FetchableRecord, Identifiable, Hashable, Sendable",Sendable,Medium,
Repository,PersonalValue,swift/Sources/Services/Repositories/PersonalValueRepository.swift,// Repository for PersonalValue entities using canonical PersonalValueData type.,BaseRepository<PersonalValueData>,"GRDB, Models, SQLiteData","BaseRepository<PersonalValueData>, Decodable, FetchableRecord, Sendable",@unchecked Sendable,Complex,
Repository,Semantic,swift/Sources/Services/Repositories/EmbeddingCacheRepository.swift,Repository for managing cached semantic embeddings,,"GRDB, Models, SQLiteData","Sendable, Decodable, FetchableRecord, Sendable, Decodable, FetchableRecord, Sendable, Sendable, Sendable",Sendable,Medium,
Repository,TimePeriod,swift/Sources/Services/Repositories/TimePeriodRepository.swift,// Repository for TimePeriod entities using canonical TimePeriodData type.,BaseRepository<TimePeriodData>,"GRDB, Models, SQLiteData",BaseRepository<TimePeriodData>,@unchecked Sendable,Complex,
Repository-Core,Cross-cutting,swift/Sources/Services/Repositories/Core/BaseRepository.swift,// Base class providing common repository functionality.,BaseRepository<ActionData>,"GRDB, Models, SQLiteData",BaseRepository<ActionData>,@unchecked Sendable,Medium,
Repository-Core,Cross-cutting,swift/Sources/Services/Repositories/Core/ExportSupport.swift,// Shared utilities for data export functionality across repositories.,,"GRDB, Models, SQLiteData",,None,Medium,
Repository-Core,Cross-cutting,swift/Sources/Services/Repositories/Core/QueryStrategies.swift,// Define query strategy protocols for different repository patterns.,BaseRepository<ActionData>,"GRDB, Models, SQLiteData","BaseRepository<ActionData>, JSONAggregationStrategy, BaseRepository<PersonalValueData>, SQLMacroStrategy, FetchKeyRequest, FetchKeyRequest, FetchKeyRequest",None,Medium,
Repository-Core,Cross-cutting,swift/Sources/Services/Repositories/Core/RepositoryProtocols.swift,// Core protocol hierarchy for repository abstraction layer.,BaseRepository<ActionData>,"GRDB, Models, SQLiteData",BaseRepository<ActionData>,Sendable,Medium,
Service-Deduplication,Cross-cutting,swift/Sources/Services/Deduplication/DuplicationResult.swift,Result of duplicate detection showing a potential match,,,"Identifiable, Sendable, String, Sendable, CaseIterable, String, Sendable, CaseIterable, Hashable, Sendable, Sendable, Error, LocalizedError, Sendable",Sendable,Medium,
Service-Deduplication,Goal,swift/Sources/Services/Deduplication/SemanticGoalDetector.swift,Detector for goal title duplicates using semantic similarity,,Models,Sendable,Sendable,Simple,
Service-Deduplication,Semantic,swift/Sources/Services/Deduplication/SemanticDetectable.swift,Protocol for entities that can be checked for semantic duplicates,,Models,,None,Simple,
Service-Deduplication,Semantic,swift/Sources/Services/Deduplication/SemanticDuplicateDetector.swift,Generic detector for semantic duplicates across any entity type,,Models,,Sendable,Medium,
Service-Embedding,Semantic,swift/Sources/Services/Embedding/EmbeddingGenerationService.swift,// Coordinate entity-specific embedding generation with caching and variant management.,,"CryptoKit, Database, GRDB, Models, SQLiteData",Sendable,Sendable + @MainActor,Medium,
Service-Embedding,Semantic,swift/Sources/Services/Embedding/EmbeddingSourceTextBuilders.swift,// Build normalized source text for embedding generation from entity data.,,Models,"String, Sendable, Codable",None,Medium,
Service-FoundationModels,Action,swift/Sources/Services/FoundationModels/Tools/GetRecentActionsTool.swift,Tool for fetching recent actions to support reflection conversations,,"FoundationModels, SQLiteData, Services","Tool, Codable, Codable, Codable, Codable, Codable, Codable",None,Medium,
Service-FoundationModels,Cross-cutting,swift/Sources/Services/FoundationModels/ConversationError.swift,Errors that can occur during AI conversation operations,,,"Error, Sendable",None,Simple,
Service-FoundationModels,Cross-cutting,swift/Sources/Services/FoundationModels/ConversationHistory.swift,A single prompt-response exchange with the AI assistant,@Table,SQLiteData,"Codable, Sendable",None,Simple,
Service-FoundationModels,Cross-cutting,swift/Sources/Services/FoundationModels/ModelAvailability.swift,Monitors the availability of the on-device language model,@Observable @MainActor,FoundationModels,,@MainActor,Medium,
Service-FoundationModels,Cross-cutting,swift/Sources/Services/FoundationModels/Tools/AnalyzeAlignmentToolPlaceholder.swift,Tool for analyzing how well goals align with personal values,,"FoundationModels, Models, SQLiteData, Services","Tool, Codable, Codable, Codable, Codable, Codable, Codable",None,Simple,
Service-FoundationModels,Cross-cutting,swift/Sources/Services/FoundationModels/Tools/GetProgressToolPlaceholder.swift,Tool for analyzing progress toward goals,,"FoundationModels, Models, SQLiteData","Tool, Codable, Codable, Codable",None,Simple,
Service-FoundationModels,Goal,swift/Sources/Services/FoundationModels/Services/GoalCoachService.swift,Service for AI-powered goal coaching using Foundation Models,,"FoundationModels, SQLiteData, Services","Sendable, Sendable, LocalizedError",Sendable,Medium,
Service-FoundationModels,Goal,swift/Sources/Services/FoundationModels/Tools/CheckDuplicateGoalTool.swift,Tool for checking if a goal would be a duplicate before creation,,"FoundationModels, Models, SQLiteData, Services","Tool, Codable, Codable, Codable, LocalizedError",None,Medium,
Service-FoundationModels,Goal,swift/Sources/Services/FoundationModels/Tools/CreateGoalTool.swift,Tool for creating new goals with validation and deduplication,,"Dependencies, FoundationModels, Models, SQLiteData, Services","Tool, Codable, Codable, Codable, Codable, LocalizedError",None,Medium,
Service-FoundationModels,Goal,swift/Sources/Services/FoundationModels/Tools/GetGoalsTool.swift,Tool for fetching user's goals with details,,"Database, FoundationModels, Models, SQLiteData, Services","Tool, Codable, Codable, Codable, Codable, Codable",None,Simple,
Service-FoundationModels,Measure,swift/Sources/Services/FoundationModels/Tools/GetMeasuresTool.swift,Tool for fetching available measurement types,,"FoundationModels, Models, SQLiteData","Tool, Codable, Sendable, Codable, Codable",None,Simple,
Service-FoundationModels,PersonalValue,swift/Sources/Services/FoundationModels/Tools/GetValuesTool.swift,Tool for fetching user's personal values,,"Database, FoundationModels, Models, SQLiteData, Services","Tool, Codable, Codable, Codable, Codable",None,Simple,
Service-HealthKit,HealthKit,swift/Sources/Services/HealthKit/HealthKitImportService.swift,// Converts HealthKit workouts to app Actions with measurements,,,,@MainActor,Medium,
Service-HealthKit,HealthKit,swift/Sources/Services/HealthKit/HealthKitLiveTrackingService.swift,// Real-time HealthKit monitoring using HKAnchoredObjectQuery for live metric updates.,,HealthKit,,@MainActor,Medium,
Service-HealthKit,HealthKit,swift/Sources/Services/HealthKit/HealthKitManager.swift,Manager for HealthKit operations (iOS only),@Observable @MainActor,"HealthKit, Observation","LocalizedError, Error",@MainActor,Complex,
Service-HealthKit,HealthKit,swift/Sources/Services/HealthKit/Models/HealthMindfulness.swift,// Display model for Apple Health mindfulness data. Maps HKCategorySample (mindfulSession),,HealthKit,"Identifiable, Sendable, Identifiable, Sendable",None,Medium,
Service-HealthKit,HealthKit,swift/Sources/Services/HealthKit/Models/HealthSleep.swift,// Display model for Apple Health sleep data. Maps HKCategorySample (sleepAnalysis),,HealthKit,"Identifiable, Sendable, Sendable, Identifiable, Sendable, Sendable",Sendable,Medium,
Service-HealthKit,HealthKit,swift/Sources/Services/HealthKit/Models/HealthWorkout.swift,// Display model for Apple Health workout data. Maps HKWorkout to app-friendly structure,,HealthKit,"Identifiable, Sendable, Identifiable, Sendable",None,Medium,
Service-ImportExport,Cross-cutting,swift/Sources/Services/ImportExport/CSVFormatter.swift,// CSV encoding service for export data types.,,Models,,None,Medium,
Service-ImportExport,Cross-cutting,swift/Sources/Services/ImportExport/CSVParser.swift,// RFC 4180 compliant CSV parser for import functionality.,,Models,,None,Medium,
Service-ImportExport,Cross-cutting,swift/Sources/Services/ImportExport/DataImporter.swift,// Main import service - coordinates parse → validate → transform → create.,Sendable Coordinator,"Models, SQLiteData",Sendable,Sendable,Medium,
Service-ImportExport,Cross-cutting,swift/Sources/Services/ImportExport/EntityParsers.swift,// Convert CSV row dictionaries → canonical Data types.,,Models,"Decodable, Decodable",None,Medium,
Service-ImportExport,Cross-cutting,swift/Sources/Services/ImportExport/Exporter.swift,// Data export service - handles repository dispatch and format encoding.,,"Models, SQLiteData","Sendable, Sendable",Sendable,Simple,
Service-ImportExport,Cross-cutting,swift/Sources/Services/ImportExport/FormDataTransformer.swift,// Transform canonical Data types → FormData for coordinator creation.,,Models,,None,Simple,
Service-ImportExport,Cross-cutting,swift/Sources/Services/ImportExport/ImportTypes.swift,// Data structures for import preview and result reporting.,,Models,"Equatable, Sendable, Identifiable, Sendable",None,Medium,
Service-ImportExport,Cross-cutting,swift/Sources/Services/ImportExport/ImportValidator.swift,// Validate import records before database writes.,,"Models, SQLiteData",Sendable,Sendable,Medium,
Service-ImportExport,Cross-cutting,swift/Sources/Services/ImportExport/Importers.swift,,,,,None,Simple,
Service-ImportExport,Cross-cutting,swift/Sources/Services/ImportExport/JSONParser.swift,// JSON parser for import functionality.,,Models,,None,Simple,
Service-Other,Cross-cutting,swift/Sources/Services/MatchingService.swift,Business logic for matching actions to goals,,Models,"Sendable, Sendable",Sendable,Medium,
Service-Other,Semantic,swift/Sources/Services/Dependencies+Semantic.swift,Semantic service for embedding generation and similarity calculation,@Observable @MainActor,Dependencies,"DependencyKey, Sendable",Sendable + @MainActor,Simple,
Service-Progress,Cross-cutting,swift/Sources/Services/Progress/ActiveStatusService.swift,Enhanced active/inactive detection and filtering for all Expectation types,,"Database, Models","Sendable, Sendable",Sendable + @MainActor,Medium,
Service-Progress,Cross-cutting,swift/Sources/Services/Progress/ProgressAggregationService.swift,"Aggregate progress data at different levels (goal, term, period, portfolio)",,"Database, Models",Sendable,Sendable + @MainActor,Medium,
Service-Progress,Cross-cutting,swift/Sources/Services/Progress/ProgressCalculationService.swift,Calculate individual progress metrics for all Expectation types,,Models,"Sendable, Sendable, Sendable, Sendable",Sendable + @MainActor,Medium,
Service-Semantic,PersonalValue,swift/Sources/Services/Semantic/ValueAlignmentService.swift,// Compute goal-value alignment matrix using semantic embeddings.,,"Database, Models, SQLiteData",Sendable,Sendable + @MainActor,Medium,
Service-Semantic,Semantic,swift/Sources/Services/Semantic/EmbeddingBackfillService.swift,Background service to ensure all entities have semantic embeddings,,"GRDB, Models, SQLiteData",,None,Complex,
Service-Semantic,Semantic,swift/Sources/Services/Semantic/SemanticService.swift,Semantic embedding service with integrated caching,,"CryptoKit, Database, Models, NaturalLanguage, SQLiteData",Sendable,Sendable + @MainActor,Medium,
Service-Validation,Cross-cutting,swift/Sources/Services/Validation/ValidationError.swift,// Defines all validation errors with user-friendly messages.,,,LocalizedError,None,Simple,
Service-Validation,Cross-cutting,swift/Sources/Services/Validation/ValidationRules.swift,// Entity-specific validation rules organized by domain entity.,,Models,,None,Medium,
Service-Validation,Cross-cutting,swift/Sources/Services/Validation/ValidationUtilities.swift,// Single unified validator with generalized validation functions.,,,,None,Medium,
Unknown,Cross-cutting,swift/Sources/App/Views/ContentView.swift,Root view for the application,SwiftUI View,,"View, View",None,Simple,
View-Analytics,PersonalValue,swift/Sources/App/Views/Analytics/ValueAlignmentHeatmapView.swift,Heatmap visualization showing semantic alignment between goals and values,SwiftUI View,Models,"View, View",None,Medium,
View-CSV,Cross-cutting,swift/Sources/App/Views/CSV/CSVExportImportView.swift,// Simple data export UI. Uses DataExporter to write raw text dumps.,SwiftUI View,"Dependencies, Models, SQLiteData, Services, UniformTypeIdentifiers","View, FileDocument",@MainActor,Medium,
View-CSV,Cross-cutting,swift/Sources/App/Views/CSV/ImportPreviewView.swift,// Preview import records with validation status and user selection.,SwiftUI View,"Models, Services",,@MainActor,Complex,
View-CSV,Cross-cutting,swift/Sources/App/Views/CSV/ImportResultView.swift,// Display import operation results with success/failure breakdown.,SwiftUI View,Services,View,None,Medium,
View-Component,Cross-cutting,swift/Sources/App/Views/Components/FormComponents/MetricTargetRow.swift,Row view for metric target input (like MeasurementInputRow),SwiftUI View,"Dependencies, Models, SQLiteData, Services",View,@MainActor,Medium,
